{
  "baseline_collected_node_count": 2383,
  "baseline_module_count": 182,
  "baseline_revision": "13c814ce53cab46b1d1a2cebab091c8a88bd33d4",
  "expected_collected_node_count": 2648,
  "expected_module_count": 193,
  "modules": [
    {
      "conformance_status": "conforming",
      "content_sha256": "a2564bfd656b8d937e3ca47f45e262d75215ebb120adbab888538323d651a8b5",
      "evidence_class": "numerical_verification",
      "mode": "class_owned",
      "path": "python/tests/numerical_verification/ksdft2effmass/operators/test__Geometry__linear_independence.py",
      "sut": "Geometry"
    },
    {
      "conformance_status": "conforming",
      "content_sha256": "0e095b3b6bbf4b4aa9eac17733e2b7d40eda9732d9f5deb4b9a871a95e9b6301",
      "evidence_class": "numerical_verification",
      "mode": "class_owned",
      "path": "python/tests/numerical_verification/ksdft2effmass/operators/test__HermiticityAnalyzer__analytical_residuals.py",
      "sut": "HermiticityAnalyzer"
    },
    {
      "conformance_status": "conforming",
      "content_sha256": "6fc5a2fef9b96c60d58cb8ab204d9dade64dff3c085da6b889eab6709301b162",
      "evidence_class": "numerical_verification",
      "mode": "class_owned",
      "path": "python/tests/numerical_verification/ksdft2effmass/operators/test__OperatorRecordResidualAnalyzer__analytical_norms.py",
      "sut": "OperatorRecordResidualAnalyzer"
    },
    {
      "conformance_status": "conforming",
      "content_sha256": "893316d905a6ec1f1f70ebe4ed3486219fdb4962cfd2e50c1550577f8168b517",
      "evidence_class": "numerical_verification",
      "mode": "class_owned",
      "path": "python/tests/numerical_verification/ksdft2effmass/operators/test__OperatorRecordResidualAnalyzer__floating_point.py",
      "sut": "OperatorRecordResidualAnalyzer"
    },
    {
      "artifact": "h4 hc02 route fail closed",
      "conformance_status": "conforming",
      "content_sha256": "d30d722f098f45b7a72e5cc4048b813a221d77b9591914c31bf9af5344c7b6b9",
      "evidence_class": "software_verification",
      "mode": "artifact_owned",
      "path": "python/tests/software_verification/ksdft2effmass/harness/pi/local/test__h4_hc02_route_fail_closed.py"
    },
    {
      "artifact": "h4 replay and completion evidence",
      "conformance_status": "conforming",
      "content_sha256": "fd91c1ea90dda9a06a5b83dd732f2743f3ade9f22f64bbcd3999687e3844f180",
      "evidence_class": "software_verification",
      "mode": "artifact_owned",
      "path": "python/tests/software_verification/ksdft2effmass/harness/pi/local/test__h4_replay_and_completion_evidence.py"
    },
    {
      "artifact": "inspect task state command api agreement",
      "conformance_status": "conforming",
      "content_sha256": "f759a531361833a5bace65bcfbc74d505218fad6c9fcdef36f69ad0fb88a43d6",
      "evidence_class": "software_verification",
      "mode": "artifact_owned",
      "path": "python/tests/software_verification/ksdft2effmass/harness/pi/local/test__inspect_task_state_command_api_agreement.py"
    },
    {
      "artifact": "local context dependency and nonmutation",
      "conformance_status": "conforming",
      "content_sha256": "090d966b4d50ebfe3baae7d20397166c7dd4b7ea38d890c999485235e2b20fa4",
      "evidence_class": "software_verification",
      "mode": "artifact_owned",
      "path": "python/tests/software_verification/ksdft2effmass/harness/pi/local/test__local_context_dependency_and_nonmutation.py"
    },
    {
      "artifact": "local public api and models",
      "conformance_status": "conforming",
      "content_sha256": "4deddbb4973dfc28a5ea3e51e66de13a016b403c25c547739d4f5d075bbee28c",
      "evidence_class": "software_verification",
      "mode": "artifact_owned",
      "path": "python/tests/software_verification/ksdft2effmass/harness/pi/local/test__local_public_api_and_models.py"
    },
    {
      "artifact": "local repository validation",
      "conformance_status": "conforming",
      "content_sha256": "2dbada932e876a7ccba816d58b608041da17d2987dac52c3a1c2b12e510924ea",
      "evidence_class": "software_verification",
      "mode": "artifact_owned",
      "path": "python/tests/software_verification/ksdft2effmass/harness/pi/local/test__local_repository_validation.py"
    },
    {
      "artifact": "local routing and shadow",
      "conformance_status": "conforming",
      "content_sha256": "3a64a703235ab22be29615ca0a9384323f0b098853c389a77e9efa4f728c1558",
      "evidence_class": "software_verification",
      "mode": "artifact_owned",
      "path": "python/tests/software_verification/ksdft2effmass/harness/pi/local/test__local_routing_and_shadow.py"
    },
    {
      "artifact": "local strict adapters",
      "conformance_status": "conforming",
      "content_sha256": "9a84ad8acb9717b334fda67757079dec9f8a6cb7b3f64dcdd0af970f98fe270b",
      "evidence_class": "software_verification",
      "mode": "artifact_owned",
      "path": "python/tests/software_verification/ksdft2effmass/harness/pi/local/test__local_strict_adapters.py"
    },
    {
      "conformance_status": "conforming",
      "content_sha256": "9d6dfde05fe8e0f67dd1d5fb94fbd54c0e9c9e06b7fee2997ae4120c776a1e93",
      "evidence_class": "software_verification",
      "mode": "class_owned",
      "path": "python/tests/software_verification/ksdft2effmass/harness/pi/test__AgentDescriptorView.py",
      "sut": "AgentDescriptorView"
    },
    {
      "conformance_status": "conforming",
      "content_sha256": "14b4b596a1e6c6fb9140ed7aa82645de6effab0d8ff4eeee94b8df2d2f45e055",
      "evidence_class": "software_verification",
      "mode": "class_owned",
      "path": "python/tests/software_verification/ksdft2effmass/harness/pi/test__ArtifactIdentity.py",
      "sut": "ArtifactIdentity"
    },
    {
      "conformance_status": "conforming",
      "content_sha256": "e2c8c7d6af1adddbc2e336495d9bd5f3e054f3ca14699bfc56665972a012274e",
      "evidence_class": "software_verification",
      "mode": "class_owned",
      "path": "python/tests/software_verification/ksdft2effmass/harness/pi/test__AuditEvidenceIdentifiers.py",
      "sut": "AuditEvidenceIdentifiers"
    },
    {
      "conformance_status": "conforming",
      "content_sha256": "a8e6c995fc5fd665f1f099258d5bc32781842540b211c2f9e47f4844249068c3",
      "evidence_class": "software_verification",
      "mode": "class_owned",
      "path": "python/tests/software_verification/ksdft2effmass/harness/pi/test__ChainEvaluationResult.py",
      "sut": "ChainEvaluationResult"
    },
    {
      "conformance_status": "conforming",
      "content_sha256": "8ef0be1f0775165d5bb0326b5d34b7309b8245e1cc2638764c9c2896c0a4af40",
      "evidence_class": "software_verification",
      "mode": "class_owned",
      "path": "python/tests/software_verification/ksdft2effmass/harness/pi/test__ChainView.py",
      "sut": "ChainView"
    },
    {
      "conformance_status": "conforming",
      "content_sha256": "f1cc942eb0d23cab138b0d1fa2757a3d2b6a7d35cc6ef0c3436bfea21c7f7598",
      "evidence_class": "software_verification",
      "mode": "class_owned",
      "path": "python/tests/software_verification/ksdft2effmass/harness/pi/test__CheckpointRecord.py",
      "sut": "CheckpointRecord"
    },
    {
      "conformance_status": "conforming",
      "content_sha256": "36e8941221c6f32bee8cec3ee4fd9b6f42843b8d5034344c2d4ed8db4e26b7bd",
      "evidence_class": "software_verification",
      "mode": "class_owned",
      "path": "python/tests/software_verification/ksdft2effmass/harness/pi/test__ChecksumEntry.py",
      "sut": "ChecksumEntry"
    },
    {
      "conformance_status": "conforming",
      "content_sha256": "194a823fe68404e0d372f804e8cd0202d26f2a951fc5e2682bfe70fbd83fd288",
      "evidence_class": "software_verification",
      "mode": "class_owned",
      "path": "python/tests/software_verification/ksdft2effmass/harness/pi/test__ChecksumManifest.py",
      "sut": "ChecksumManifest"
    },
    {
      "conformance_status": "conforming",
      "content_sha256": "f73bb97583f28689f4744fe83a16f2d756bdf7167e0ae48642e1467d6dbabf2a",
      "evidence_class": "software_verification",
      "mode": "class_owned",
      "path": "python/tests/software_verification/ksdft2effmass/harness/pi/test__DeserializeJsonRecord.py",
      "sut": "DeserializeJsonRecord"
    },
    {
      "conformance_status": "conforming",
      "content_sha256": "94a9df25e76fc31037affd56b433e2e4ed9e94e208cb66eb96eb8022ef06e251",
      "evidence_class": "software_verification",
      "mode": "class_owned",
      "path": "python/tests/software_verification/ksdft2effmass/harness/pi/test__EvaluateChainState.py",
      "sut": "EvaluateChainState"
    },
    {
      "conformance_status": "conforming",
      "content_sha256": "170bce99c70f4451c7fb156c6b398ba69fe3ce8f260306917cd2160979b8dd68",
      "evidence_class": "software_verification",
      "mode": "class_owned",
      "path": "python/tests/software_verification/ksdft2effmass/harness/pi/test__EvidenceAuditResult.py",
      "sut": "EvidenceAuditResult"
    },
    {
      "conformance_status": "conforming",
      "content_sha256": "ccb109ea94daba9128562960f05ade84683b95d7db6f1fa0147770f604d734b5",
      "evidence_class": "software_verification",
      "mode": "class_owned",
      "path": "python/tests/software_verification/ksdft2effmass/harness/pi/test__EvidenceIdentifierOccurrence.py",
      "sut": "EvidenceIdentifierOccurrence"
    },
    {
      "conformance_status": "conforming",
      "content_sha256": "6beee18666fc1a9f4827867556f272ce745ed73f819ccaafe1d03aea9d89cfb3",
      "evidence_class": "software_verification",
      "mode": "class_owned",
      "path": "python/tests/software_verification/ksdft2effmass/harness/pi/test__HarnessInternalError.py",
      "sut": "HarnessInternalError"
    },
    {
      "conformance_status": "conforming",
      "content_sha256": "bc2405f8aa1accd6eda83f78721a5c7b5af7f6754b64050bfcefce3abdbc6415",
      "evidence_class": "software_verification",
      "mode": "class_owned",